Name,Price
AirForce Laced Up Comfortable Stylish Sneaker Shoes For Men By Jutta Ghar Nepal (Updated Colours),Rs.1499
Black Ankle Cut Printed Bandana Synthetic Round Toe Lace-Up Closure Medium Width Casual/Sport Sneakers For Men And Women,Rs.500
Airforce 1 Grey White Lightweight Sneaker Shoes For Men,Rs.1349
Slazenger Grey Lifestyle Shoes For Men SLCS10478,Rs.1469
Air Force 1 SB Wolf Grey Suede Premium Sneaker for Men,Rs.1499
Slazenger Navy Blue Running Shoes For Men SLCS10223,Rs.1409
AF1 Suede Premium Sneaker for Men,Rs.1699
Air Force 1 Full White Premium Sneaker for Men,Rs.1499
Black Bandana Lightweight Ankle Cut Printed Casual Sneakers Shoes For Men,Rs.649
Black Bandana Lightweight Ankle Cut Printed Casual Sneakers Shoes For Men,Rs.498
Slazenger Brown Lifestyle Shoes For Men SLCS10478,Rs.1469
Air Force 1 High Top Grey White Sneaker with Belt for Men,Rs.1799
Slazenger Olive Lifestyle Shoes For Men SLCS10560,Rs.1469
Slazenger Black Running Shoes For Men SLCS10448,Rs.1409
Slazenger Black Lifestyle Shoes For Men SLCS10559,Rs.1469
Jordan 4 Non Mettalic Sneakers Shoes For Men By Jutta Ghar Nepal - Fashion | Sneakers For Men,Rs.2399
AF1 Grey White Sneaker for Men,Rs.1599
Air Force 1 High Top Full White Sneaker with Belt for Men,Rs.1799
Goldstar J Boot 1 Black Lace-Up Shoes For Men - Fashion | Shoes For Men | Men's Footwear | Goldstar Shoes |,Rs.1399
Slazenger Dark Grey Running Shoes For Men SLCS10223,Rs.1409
